{
    "$schema": "../vinv.json",
    "v": "0.1-alpha",
    "trees": [
        {
            "fddd":[
                [[23.56,23.222], 12],
                "34_",
                23,12, 
                [[0.5,5], [0.3,5]],
                "2018-11-13",
                {"obj": "https://www.der.de"}
            ],
            "sdfsdfs":[
                [[23.56,23.222, 0], 12],
                "34_",
                23,
                12, 
                [[0.3,5], [0.6,5]],
                "2018-11-13",
                {"obj": "https://www.der.de"}
            ]
        }
    ],
    "roads": [
        {
            "sdfsdfd":[
                [
                    [
                        [23.56,23.222]
                    ],
                    [
                        [23.56,23.222, 0],
                        49.83
                    ],
                    [
                        [23.56,23.222, 0],
                        40.44
                    ],
                    [
                        [23.56,23.222, 0],
                        36.59
                    ],
                    [
                        [23.56,23.222, 0],
                        32.24
                    ]
                ],
                "dsfsdf"
            ]
        }
    ],
    "area": [
        {
            "sdfsdfd":[
                [
                    [
                        [
                            [23.56,23.222]
                        ],
                        [
                            [23.56,23.222, 0],
                            23
                        ],
                        [
                            [23.56,23.222, 0],
                            40.44
                        ],
                        [
                            [23.56,23.222, 0],
                            36.59
                        ],
                        [
                            [23.56,23.222, 0],
                            32.24
                        ]
                    ]
                ],
                "dsfsdf"
            ]
        }
    ],
    "fallbacks": [
        [
            [
                ["sf6", "9hD"],
                [0,100]
            ],
            [
                [[23.56,23.222], 12],
                "34_",
                23, 12,
                [[0.2,5], [0.1,5]],
                "2018-11-13",
                {"obj": "https://www.der.de"}
            ]
        ]
    ]
}